{
  "schema_version": 2,
  "resource_kind": "bench_configuration",
  "resource_id": "ca4m4.norvale.bench.three-judge",
  "court_id": "us.ca4.court.appeals",
  "presiding_seat_id": "ca4m4.norvale.seat.quill",
  "seats": [
    {"seat_id":"ca4m4.norvale.seat.quill","profile_id":"us.ca4.bench-profile.quill","court_role":"appellate"},
    {"seat_id":"ca4m4.norvale.seat.fen","profile_id":"us.ca4.bench-profile.fen","court_role":"appellate"},
    {"seat_id":"ca4m4.norvale.seat.vale","profile_id":"us.ca4.bench-profile.vale","court_role":"appellate"}
  ]
}
