{
  "schema_version": 2,
  "resource_kind": "bench_configuration",
  "resource_id": "ca4m4.serrano.bench.three-judge",
  "court_id": "us.ca4.court.appeals",
  "presiding_seat_id": "ca4m4.serrano.seat.slate",
  "seats": [
    {
      "seat_id": "ca4m4.serrano.seat.slate",
      "profile_id": "us.ca4.bench-profile.slate",
      "court_role": "appellate"
    },
    {
      "seat_id": "ca4m4.serrano.seat.alder",
      "profile_id": "us.ca4.bench-profile.alder",
      "court_role": "appellate"
    },
    {
      "seat_id": "ca4m4.serrano.seat.march",
      "profile_id": "us.ca4.bench-profile.march",
      "court_role": "appellate"
    }
  ]
}
