{
  "schema_version": 2,
  "resource_kind": "bench_configuration",
  "resource_id": "ca4m4.arm.bench.three-judge",
  "court_id": "us.ca4.court.appeals",
  "presiding_seat_id": "ca4m4.arm.seat.rowan",
  "seats": [
    {
      "seat_id": "ca4m4.arm.seat.rowan",
      "profile_id": "us.ca4.bench-profile.rowan",
      "court_role": "appellate"
    },
    {
      "seat_id": "ca4m4.arm.seat.reed",
      "profile_id": "us.ca4.bench-profile.reed",
      "court_role": "appellate"
    },
    {
      "seat_id": "ca4m4.arm.seat.quill",
      "profile_id": "us.ca4.bench-profile.quill",
      "court_role": "appellate"
    }
  ]
}
