{
  "schema_version": 2,
  "resource_kind": "bench_configuration",
  "resource_id": "ca4m4.ellison.bench.three-judge",
  "court_id": "us.ca4.court.appeals",
  "presiding_seat_id": "ca4m4.ellison.seat.alder",
  "seats": [
    {"seat_id":"ca4m4.ellison.seat.alder","profile_id":"us.ca4.bench-profile.alder","court_role":"appellate"},
    {"seat_id":"ca4m4.ellison.seat.reed","profile_id":"us.ca4.bench-profile.reed","court_role":"appellate"},
    {"seat_id":"ca4m4.ellison.seat.march","profile_id":"us.ca4.bench-profile.march","court_role":"appellate"}
  ]
}
