{"schema_version":2,"resource_kind":"bench_configuration","resource_id":"ca4r54b.bench.composite-three","court_id":"us.ca4.court.appeals","presiding_seat_id":"ca4r54b.seat.vale","seats":[{"seat_id":"ca4r54b.seat.vale","profile_id":"us.ca4.bench-profile.vale","court_role":"appellate"},{"seat_id":"ca4r54b.seat.rowan","profile_id":"us.ca4.bench-profile.rowan","court_role":"appellate"},{"seat_id":"ca4r54b.seat.alder","profile_id":"us.ca4.bench-profile.alder","court_role":"appellate"}]}
